experience_id,experience_name,link
850909,Rotorua: WAIMANGU VOLCANIC VALLEY Half-Day Tour,https://www.getyourguide.com/en-gb/rotorua-l1398/from-rotorua-waimangu-volcanic-valley-half-day-tour-t850909/
1070592,Queenstown: Nevis Swing & Catapult Combo,https://www.getyourguide.com/en-gb/queenstown-l498/queenstown-nevis-swing-catapult-combo-t1070592/
463930,Waiheke Island: Sip and Savor 3 Vineyards Tour with Lunch,https://www.getyourguide.com/en-gb/auckland-l822/sip-savour-through-waiheke-island-wlunch-11guests-max-t463930/
27030,Auckland: Auckland Canyoning Rainforest Adventure,https://www.getyourguide.com/en-gb/auckland-region-l821/auckland-canyoning-rainforest-adventure-t27030/
853963,Lake Tekapo: Merino Sheep Shearing and Sheepdog Demonstration,https://www.getyourguide.com/en-gb/lake-tekapo-l113317/tekapo-merino-sheep-shearing-and-sheepdog-demonstration-t853963/
834151,"Auckland: Mt. Eden, Piha Beach & Karekare Private Tour",https://www.getyourguide.com/en-gb/auckland-l822/private-tour-mt-eden-piha-beach-karekare-t834151/
519392,Te Anau: Glacier and Waterfall Helicopter Experience,https://www.getyourguide.com/en-gb/southland-l1041/milford-sound-glacier-and-waterfall-helicopter-experience-t519392/
172686,Queenstown: Mount Aspiring Full-Day Canyoning Adventure,https://www.getyourguide.com/en-gb/queenstown-l498/from-queenstown-mount-aspiring-full-day-canyoning-adventure-t172686/
304823,Wanaka: Self-Guided Regular MTB - Lake Hawea to Lake Wanaka,https://www.getyourguide.com/en-gb/wanaka-l946/wanaka-self-guided-bike-tour-from-lake-hawea-to-lake-wanaka-t304823/
171396,Queenstown: Skippers Canyon 4WD Heritage Tour from Queenstown,https://www.getyourguide.com/en-gb/queenstown-l498/queenstown-skippers-canyon-4wd-gold-heritage-tour-t171396/
835514,Auckland: Waiheke Island Wine Tours - PREMIUM Wines - Max 11 clients !,https://www.getyourguide.com/en-gb/waiheke-island-l2324/waiheke-island-wine-tours-premium-wines-max-11-clients--t835514/
1345480,Auckland: Beach & Dune Horse Trek for Beginner Riders,https://www.getyourguide.com/en-gb/auckland-l822/auckland-beach-dune-horse-trek-for-beginner-riders-t1345480/
1316666,"Picton: Queen Charlotte Track Cruise, Walk & Motuara Island Tour",https://www.getyourguide.com/en-gb/picton-l32311/queen-charlotte-track-cruise-walk-motuara-island-tour-t1316666/
169168,Dunedin: Dunedin City & Coastal Views 3-Hour Small-Group Tour,https://www.getyourguide.com/en-gb/dunedin-l2026/dunedin-city-coastal-views-3-hour-small-group-tour-t169168/
49445,Akaroa: Akaroa Marine Reserve Sea Kayaking Tour,https://www.getyourguide.com/en-gb/akaroa-l2149/kayak-akaroa-eco-tour-3-hours-t49445/
647731,Dunedin: Otago Peninsula Scenery & Little Blue Penguin tour,https://www.getyourguide.com/en-gb/dunedin-l2026/otago-peninsula-scenery-little-blue-penguin-tour-t647731/
197938,Waitangi: Kawiti Glow Worm Cave & Opua Kauri Forest Walk,https://www.getyourguide.com/en-gb/waitangi-l91770/kawiti-glowworm-cave-tour-t197938/
397803,"Oneroa, New Zealand: Waiheke Whisky Distillery Tour + Olive Oil + Food",https://www.getyourguide.com/en-gb/auckland-l822/waiheke-scenic-taste-graze-tour-with-wine-whisky-beer-t397803/
401775,Southland Region: Self-Guided Milford Track Day Walk,https://www.getyourguide.com/en-gb/southland-l1041/milford-sound-milford-track-day-hike-t401775/
1209263,Christchurch: Christchurch Walking Tour: Hidden Gems & Quake stories,https://www.getyourguide.com/en-gb/christchurch-l945/christchurch-walking-tour-with-local-guide-t1209263/
837047,From Taumarunui: The Republic Rail Cart Adventure,https://www.getyourguide.com/en-gb/taumarunui-l149208/from-taumarunui-the-republic-rail-cart-adventure-t837047/
1104065,Lake Tekapo: Tekapo to Queenstown via Mt Cook Small Group Tour (One Way),https://www.getyourguide.com/en-gb/lake-tekapo-l113317/tekapo-to-queenstown-via-mt-cook-small-group-tour-one-way-t1104065/
869772,Auckland: Create Your Own Bespoke Fragrance,https://www.getyourguide.com/en-gb/auckland-l822/auckland-create-your-own-bespoke-fragrance-t869772/
1210912,Auckland: Odyssey Sensory Maze Entrance Ticket,https://www.getyourguide.com/en-gb/auckland-l822/auckland-odyssey-sensory-maze-entrance-ticket-t1210912/
1310936,Hanmer Springs: 2-Hour Quad Bike Safari,https://www.getyourguide.com/en-gb/hanmer-springs-l91743/hanmer-springs-2-hour-quad-bike-safari-t1310936/
468947,Manapouri: Te Anau | 55-Min Doubtful Sound Helicopter Discovery,https://www.getyourguide.com/en-gb/te-anau-l937/te-anau-doubtful-sound-discovery-t468947/
335836,Queenstown: Ice Bar Crawl,https://www.getyourguide.com/en-gb/queenstown-l498/queenstown-ice-bar-crawl-t335836/
259542,Te Anau: 30-Minute Fiordland National Park Scenic Flight,https://www.getyourguide.com/en-gb/te-anau-l937/te-anau-30-minute-fiordland-national-park-scenic-flight-t259542/
158202,Wellington: Wellington City to Coast Highlights Guided Tour,https://www.getyourguide.com/en-gb/wellington-l943/wellington-cave-to-coast-highlights-guided-tour-t158202/
495730,Albert Town: Wānaka: Gladstone Track and Wanaka Trails on Bike or eBike,https://www.getyourguide.com/en-gb/wanaka-l946/bike-the-wanaka-and-hawea-trails-t495730/
171390,Queenstown: 4WD Lord Of the Rings Half-Day Tour,https://www.getyourguide.com/en-gb/queenstown-l498/glenorchy-4wd-lord-of-the-rings-half-day-tour-t171390/
148313,Wanaka: Ruby Island 1-Hour Cruise and Photo Walk,https://www.getyourguide.com/en-gb/wanaka-l946/ruby-island-1-hour-cruise-and-walk-t148313/
563675,"Auckland: Sheepworld, Honey Centre, & Kauri Trail Tour",https://www.getyourguide.com/en-gb/auckland-region-l821/auckland-sheepworld-honey-centre-kauri-trail-tour-t563675/
1281461,Queenstown: Shotover Canyon Swing - World's First!,https://www.getyourguide.com/en-gb/queenstown-l498/queenstown-shotover-canyon-swing-world-s-first-t1281461/
410694,Russell: 1-Hour Sightseeing Tour by Coach & Long Beach,https://www.getyourguide.com/en-gb/russell-l91734/russell-1-hour-sightseeing-tour-by-coach-long-beach-t410694/
494673,From Wellington: Remutaka Rail Trail eBike Tour,https://www.getyourguide.com/en-gb/wellington-l943/from-wellington-remutaka-rail-trail-ebike-tour-t494673/
1170286,Kaikoura: Helicopter Ride Whale Watching & Mountain Landing,https://www.getyourguide.com/en-gb/kaikoura-l37419/kaikoura-helicopter-ride-whale-watching-mountain-landing-t1170286/
880321,Napier: Highlights & Tour Exploring the Best of this Region,https://www.getyourguide.com/en-gb/napier-l2644/napier-highlights-tour-exploring-the-best-of-this-region-t880321/
24341,Queenstown: Mount Cook Full-Day Tour: Queenstown to Christchurch,https://www.getyourguide.com/en-gb/queenstown-l498/mount-cook-day-tour-queenstown-to-christchurch-t24341/
250567,Raglan: Sunset Canyoning Tour and Glowworm Experience,https://www.getyourguide.com/en-gb/hamilton-new-zealand-l91923/raglan-sunset-canyoning-tour-and-glowworm-experience-t250567/
133665,Certified by GetYourGuide: Tikitere: Hell's Gate Geothermal Walk,https://www.getyourguide.com/en-gb/rotorua-l1398/hells-gate-geothermal-reserve-park-entry-t133665/
228682,"Auckland: Rotorua Highlights Tour + Waiotapu, Lunch & Add-On",https://www.getyourguide.com/en-gb/auckland-l822/auckland-rotorua-highlights-inc-wai-o-tapu-t228682/
394554,Queenstown: Guided E-Bike Tour with Winery Visits & Tastings,https://www.getyourguide.com/en-gb/queenstown-l498/queenstown-guided-ebike-wine-tour-5-hours-of-adventure-t394554/
1286790,Queenstown: Middle Earth Adventure: Glenorchy & Paradise LOTR tour,https://www.getyourguide.com/en-gb/queenstown-l498/middle-earth-adventure-glenorchy-paradise-lotr-tour-t1286790/
512529,Christchurch: Guided Local Wine Tours in Waipara,https://www.getyourguide.com/en-gb/christchurch-l945/giles-guided-tour-local-wine-tours-t512529/
422033,Queenstown: Milford Sound Cruise with Helicopter Transfer,https://www.getyourguide.com/en-gb/queenstown-l498/queenstown-milford-sound-cruise-with-helicopter-transfer-t422033/
825190,From Auckland: Cathedral Cove & Hot Water Beach Tour,https://www.getyourguide.com/en-gb/auckland-l822/from-auckland-cathedral-cove-hot-water-beach-tour-t825190/
711305,Wellington: Half-Day Lord of the Rings Locations Tour,https://www.getyourguide.com/en-gb/wellington-l943/wellington-lord-of-the-rings-filming-locations-tour-t711305/
394890,Blenheim: Marlborough: Wineries Visit with Tastings and 2-Course Lunch,https://www.getyourguide.com/en-gb/marlborough-new-zealand-l35849/marlborough-taste-marlborough-tour-t394890/
984124,Auckland: “City & Coast & Country” – A Relaxed Day Tour from Auckland,https://www.getyourguide.com/en-gb/muriwai-l144615/-city-coast-country-a-relaxed-day-tour-from-auckland-t984124/
1123721,Taupo District: Taupō: Parasailing Experience over Lake Taupō,https://www.getyourguide.com/en-gb/taupo-l32328/taupo-parasailing-experience-over-lake-taupo-t1123721/
1030219,Auckland: Scenic Wine and Cheese Harbour Cruise,https://www.getyourguide.com/en-gb/auckland-l822/auckland-scenic-wine-and-cheese-harbour-cruise-t1030219/
819809,Auckland: City Lights Night Kayak Tour,https://www.getyourguide.com/en-gb/auckland-l822/auckland-city-lights-night-kayak-tour-t819809/
1220311,Queenstown: Beekeeping and Honey Spinning Experience,https://www.getyourguide.com/en-gb/queenstown-l498/queenstown-beekeeping-and-honey-spinning-experience-t1220311/
415081,"Whitianga: Cathedral Cove Cruise, Caves & Snorkelling",https://www.getyourguide.com/en-gb/whitianga-l44925/from-whitianga-cathedral-cove-cruise-snorkel-approx-10min-t415081/
398773,Rotorua: Self-Guided Geothermal Trails,https://www.getyourguide.com/en-gb/rotorua-l1398/whakarewarewa-self-guided-geothermal-trails-t398773/
1350830,Taupo: Sky Waka Gondola Ride & Peak Adventures: Entry Ticket,https://www.getyourguide.com/en-gb/ruapehu-district-council-l216550/sky-waka-gondola-ride-peak-adventures-entry-ticket-t1350830/
833239,From Auckland: Waitomo Glowworm and Ruakuri Caves Day Tour,https://www.getyourguide.com/en-gb/waitomo-l32442/from-auckland-waitomo-glowworm-and-ruakuri-caves-day-tour-t833239/
163419,Wellington: Wētā Workshop Guided Transfers & Tour,https://www.getyourguide.com/en-gb/wellington-l943/wellington-weta-workshop-guided-tour-ticket-transfer-t163419/
868942,Auckland: Ex Auckland: Hobbiton & Rotorua Māori Village w Hangi Lunch,https://www.getyourguide.com/en-gb/auckland-l822/ex-auckland-hobbiton-rotorua-maori-village-w-hangi-lunch-t868942/
727296,Pre-Sunset Guided Walking Tour,https://www.getyourguide.com/en-gb/mount-ruapehu-l88117/tongariro-national-park-pre-sunset-guided-walking-tour-t727296/
322603,Queenstown: Ticket for 2 Indoor Skydiving Flights,https://www.getyourguide.com/en-gb/queenstown-l498/queenstown-ticket-for-2-indoor-skydiving-flights-t322603/
1333932,Queenstown: Snow Farm & Lake Wanaka Tree Day Tour,https://www.getyourguide.com/en-gb/cardrona-l91585/queenstown-snow-farm-lake-wanaka-tree-day-tour-t1333932/
952091,"Auckland: Rotorua inc WaiOTapu, Redwoods Treewalk & Lunch",https://www.getyourguide.com/en-gb/rotorua-l1398/auckland-rotorua-highlights-w-waiotapu-redwoods-treewalk-t952091/
1068273,From Te Anau: Milford Sound Extended Cruise and Coach Tour,https://www.getyourguide.com/en-gb/te-anau-l937/from-te-anau-milford-sound-extended-cruise-and-coach-tour-t1068273/
1347585,Christchurch: Waipara Wine Trail with Lunch Included,https://www.getyourguide.com/en-gb/christchurch-l945/christchurch-waipara-wine-trail-with-lunch-included-t1347585/
327986,"Lake Tekapo: Glaciers, Mountains, and Landscapes Scenic Tour",https://www.getyourguide.com/en-gb/lake-tekapo-l113317/lake-tekapo-glaciers-mountains-and-landscapes-scenic-tour-t327986/
574460,Waimarino: Round-Trip Shuttle Service,https://www.getyourguide.com/en-gb/manawatu-whanganui-l159998/tongariro-alpine-crossing-round-trip-shuttle-service-t574460/
496909,Rotorua: One-Way Trip to Auckland via Hobbiton & Waitomo,https://www.getyourguide.com/en-gb/rotorua-l1398/rotorua-one-way-trip-to-auckland-via-hobbiton-waitomo-t496909/
1088197,Rotorua: Marama Geyser Light Trail & Geothermal Experience,https://www.getyourguide.com/en-gb/rotorua-l1398/marama-geyser-light-trail-t1088197/
887436,Wanaka: Wānaka: Mt Aspiring Explorer Scenic Flight with 2 Landings,https://www.getyourguide.com/en-gb/wanaka-l946/wanaka-mt-aspiring-explorer-scenic-flight-with-2-landings-t887436/
296035,Auckland: Devonport Village Segway Tour,https://www.getyourguide.com/en-gb/auckland-l822/auckland-devonport-village-segway-tour-t296035/
41361,Queenstown: Lake Whakatipu Boat Trip,https://www.getyourguide.com/en-gb/queenstown-l498/queenstown-lake-whakatipu-boat-trip-t41361/
570763,"Gibbston: Jet Sprint Boat, Ultimate Off-Roader & Shooting",https://www.getyourguide.com/en-gb/queenstown-l498/queenstown-jet-sprint-boat-ultimate-off-roader-shooting-t570763/
1164191,Arthurs Point: Queenstown to Gibbston Winery: Self-Guided E-Bike Tour,https://www.getyourguide.com/en-gb/queenstown-l498/queenstown-to-gibbston-valley-winery-e-bike-rental-adventure-t1164191/
406490,Te Anau: Evening Champagne Cruise on Historic 1935 Motor Yacht.,https://www.getyourguide.com/en-gb/te-anau-l937/evening-champagne-cruise-on-historic-1935-motor-yacht-t406490/
1323899,Dunedin: Heritage City Walking Tour,https://www.getyourguide.com/en-gb/dunedin-l2026/dunedin-heritage-city-walking-tour-t1323899/
878228,Aoraki Mount Cook Village: Tasman Glacier Helicopter Flight,https://www.getyourguide.com/en-gb/aoraki-mount-cook-village-l126608/mount-cook-tasman-glacier-helicopter-flight-t878228/
316452,Greymouth: Hokitika Gorge and Tree Top Walkway Half-Day Tour,https://www.getyourguide.com/en-gb/greymouth-l44248/greymouth-hokitika-gorge-and-tree-top-walkway-half-day-tour-t316452/
729182,Coromandel Town: Coromandel: Wheel Throwing Pottery Class,https://www.getyourguide.com/en-gb/coromandel-town-l38680/coromandel-wheel-throwing-pottery-class-t729182/
1030607,Auckland: Devonport: Guided Food & History Walking Tour,https://www.getyourguide.com/en-gb/auckland-l822/devonport-guided-food-history-walking-tour-t1030607/
387248,Wellington: Return Cable Car Ticket,https://www.getyourguide.com/en-gb/wellington-l943/wellington-return-cable-car-ticket-t387248/
603161,From Auckland: Rotorua Māori Village & Hot Springs with Haka,https://www.getyourguide.com/en-gb/auckland-l822/from-auckland-rotorua-maori-village-hot-springs-with-haka-t603161/
1146420,Waipoua Forest: Tane Mahuta & Kauri Museum from Auckland,https://www.getyourguide.com/en-gb/northland-l930/waipoua-forest-tane-mahuta-kauri-museum-from-auckland-t1146420/
444124,Tairua,https://www.getyourguide.com/en-gb/tairua-l190838/from-tairua-2-hour-cathedral-cove-tour-with-local-guide-t444124/
30277,Russell: Late Afternoon Sailing Cruise,https://www.getyourguide.com/en-gb/paihia-l931/late-afternoon-ship-sailing-in-the-bay-of-islands-t30277/
395074,Picton: Queen Charlotte Sound Cruise with Lunch,https://www.getyourguide.com/en-gb/picton-l32311/queen-charlotte-sound-cruise-with-lunch-t395074/
798711,Muriwai: Group Surfing Lesson with Muriwai Surf School,https://www.getyourguide.com/en-gb/auckland-l822/auckland-group-surfing-lesson-with-muriwai-surf-school-t798711/
559825,"Dunedin: Small Group Castle, Coast & City Tour",https://www.getyourguide.com/en-gb/port-chalmers-l194378/from-port-chalmers-small-group-castle-coast-city-tour-t559825/
880350,Queenstown: Ex Queenstown: Mavora Lakes Middle Earth Full Day Adventure,https://www.getyourguide.com/en-gb/queenstown-l498/from-queenstown-mavora-lakes-middle-earth-adventure-t880350/
1260903,Dunedin: Guided Shore Excursion with Larnach Castle Tour,https://www.getyourguide.com/en-gb/dunedin-l2026/dunedin-guided-shore-excursion-with-larnach-castle-tour-t1260903/
1034295,Auckland: Auckland North Shore Glowworm Tour,https://www.getyourguide.com/en-gb/auckland-l822/auckland-north-shore-glowworm-tour-t1034295/
1321215,Auckland: Scenic Highlights Tour with Ferry Ride,https://www.getyourguide.com/en-gb/auckland-l822/auckland-scenic-highlights-tour-with-ferry-ride-t1321215/
214161,Christchurch: Guided Crater Rim Walk with Coastal Scenery,https://www.getyourguide.com/en-gb/christchurch-l945/christchurch-guided-crater-rim-walk-with-coastal-scenery-t214161/
428484,Glentanner: 25-Minute Alpine Vista Helicopter Flight,https://www.getyourguide.com/en-gb/glentanner-l179410/mount-cook-25-minute-alpine-vista-helicopter-flight-t428484/
1347946,Christchurch: Kaikoura Whale Watching Day Tour,https://www.getyourguide.com/en-gb/christchurch-l945/christchurch-kaikoura-whale-watching-day-tour-t1347946/
109051,Rotorua: Tarawera and Lakes 2-Hour Duck Eco Tour,https://www.getyourguide.com/en-gb/rotorua-l1398/rotorua-2-hour-tarawera-and-lakes-duck-tour-t109051/
1228336,Queenstown: Communal Hot Pool Experience,https://www.getyourguide.com/en-gb/queenstown-l498/queenstown-communal-hot-pool-experience-t1228336/
745663,Queenstown: Scenic One-Way Tour to Franz Josef,https://www.getyourguide.com/en-gb/queenstown-l498/from-queenstown-scenic-one-way-tour-to-franz-josef-t745663/
349246,Christchurch: Orana Wildlife Park Admission,https://www.getyourguide.com/en-gb/christchurch-l945/christchurch-orana-wildlife-park-admission-t349246/
943527,Christchurch: Waka Paddling & Cultural Experience (75 min),https://www.getyourguide.com/en-gb/christchurch-l945/christchurch-waka-paddling-experience-on-the-avon-river-t943527/
880472,Christchurch: Lake Tekapo Stargazing & Mount Cook 2-Day Tour,https://www.getyourguide.com/en-gb/christchurch-l945/christchurch-lake-tekapo-stargazing-mount-cook-2-day-tour-t880472/
1036299,Queenstown: Skippers Canyon Goldrush Highlights Tour,https://www.getyourguide.com/en-gb/queenstown-l498/queenstown-skippers-canyon-goldrush-highlights-tour-t1036299/
1290596,Christchurch: Longest Zipline in New Zealand Experience,https://www.getyourguide.com/en-gb/christchurch-l945/christchurch-longest-zipline-in-new-zealand-experience-t1290596/
165324,Ngongotaha: Velocity Valley - Two Ride Pass,https://www.getyourguide.com/en-gb/rotorua-l1398/rotorua-velocity-valley-two-ride-pass-t165324/
93078,Auckland: Private Walking Tour with a Local,https://www.getyourguide.com/en-gb/auckland-l822/auckland-private-walking-tour-with-a-local-t93078/
770837,Taupo District: Lake Taupō & Huka Falls River Cruise Day Tour from Auckland,https://www.getyourguide.com/en-gb/rotorua-l1398/wai-o-tapu-huka-falls-combo-day-tour-from-auckland-t770837/
560489,Karapiro: Waikato River Float Tour – Taupo,https://www.getyourguide.com/en-gb/taupo-l32328/waikato-river-float-tour-taupo-t560489/
36290,Napier: Shore Excursion: 4 Hour Discover Hawke's Bay/ Napier Tour,https://www.getyourguide.com/en-gb/hawke-s-bay-l2116/unlock-hawkes-bay-s-rural-and-art-deco-secrets-with-us-t36290/
463075,Upper Hutt: Te Awa Kairangi Grade 2 Scenic Rafting Tour,https://www.getyourguide.com/en-gb/upper-hutt-l157532/te-awa-kairangi-garde-2-scenic-float-t463075/
325038,Fox Glacier: Franz Josef: Half-Day Nature Tour to Lake Matheson,https://www.getyourguide.com/en-gb/fox-glacier-l45011/franz-josef-half-day-nature-tour-to-lake-matheson-t325038/
468616,Waitangi: Shore Excursion to Historic Kerikeri including Lunch,https://www.getyourguide.com/en-gb/paihia-l931/shore-excursion-to-historic-kerikeri-including-lunch-t468616/
1194113,"Auckland: Private Day Tour - Rotorua, Kiwi Hatchery & Māori Culture",https://www.getyourguide.com/en-gb/auckland-l822/private-day-tour-rotorua-kiwi-hatchery-maori-culture-t1194113/
917018,Blenheim: Marlborough: Full-Day Wine Tour 5-6 hours,https://www.getyourguide.com/en-gb/blenheim-l32273/marlborough-full-day-wine-tour-5-6-hours-t917018/
1088967,Hanmer Springs: River Jet Boat Ride,https://www.getyourguide.com/en-gb/hanmer-springs-l91743/hanmer-springs-river-jet-boat-ride-t1088967/
942729,Queenstown: Create Your Own Bespoke Fragrance,https://www.getyourguide.com/en-gb/queenstown-l498/queenstown-create-your-own-bespoke-fragrance-t942729/
843389,Auckland: Man O' War Vineyard Ferry (Waiheke Island),https://www.getyourguide.com/en-gb/auckland-l822/auckland-man-o-war-vineyard-ferry-waiheke-island-t843389/
607663,Aoraki Mount Cook Village: Mount Cook to Queenstown Day Tour,https://www.getyourguide.com/en-gb/aoraki-mount-cook-village-l126608/mount-cook-to-queenstown-day-tour-t607663/
434462,Tauranga: Mount Maunganui Harbour Sightseeing Cruise,https://www.getyourguide.com/en-gb/tauranga-l32196/tauranga-mount-maunganui-harbour-sightseeing-cruise-t434462/
401652,Auckland: Full-Day Dive Charter,https://www.getyourguide.com/en-gb/auckland-l822/goat-island-marine-reserve-full-day-dive-charter-t401652/
525086,Rotorua: Ultimate Self Drive 4WD Bush Safari,https://www.getyourguide.com/en-gb/rotorua-l1398/rotorua-ultimate-self-drive-4wd-bush-safari-t525086/
1114208,Auckland: Wai Ariki Hot Springs & Rotorua Redwoods Tour,https://www.getyourguide.com/en-gb/auckland-l822/auckland-wai-ariki-hot-springs-rotorua-redwoods-tour-t1114208/
1248356,Queenstown: The Dreamery Interactive Sensory Journey Entry Ticket,https://www.getyourguide.com/en-gb/queenstown-l498/the-dreamery-interactive-sensory-journey-entry-ticket-t1248356/
1136352,"Hamilton, New Zealand: Entry with Audio Guide",https://www.getyourguide.com/en-gb/hamilton-new-zealand-l91923/hamilton-gardens-entry-with-audio-guide-t1136352/
737602,Auckland: Coromandel Day Tour including Hot Water Beach,https://www.getyourguide.com/en-gb/auckland-l822/auckland-coromandel-day-tour-including-hot-water-beach-t737602/
437019,Akaroa: Scenic Coastline Wildlife Cruise,https://www.getyourguide.com/en-gb/canterbury-new-zealand-l944/akaroa-scenic-coastline-wildlife-cruise-t437019/
1115712,Christchurch: Blokart Land-sailing,https://www.getyourguide.com/en-gb/christchurch-l945/christchurch-blokart-land-sailing-t1115712/
614937,Lake Tekapo: Lake Tekapo High Country Farm Tour (Carbon Positive),https://www.getyourguide.com/en-gb/lake-tekapo-l113317/lake-tekapo-high-country-farm-tour-carbon-positive-t614937/
1012784,Auckland: Rotoroa Island and Man O'War Vineyard Combo Tour,https://www.getyourguide.com/en-gb/auckland-l822/auckland-rotoroa-island-and-man-o-war-vineyard-combo-tour-t1012784/
782051,Taupo: Huka Falls Helicopter Ride,https://www.getyourguide.com/en-gb/taupo-l32328/taupo-huka-falls-helicopter-ride-t782051/
1322749,Napier,https://www.getyourguide.com/en-gb/napier-l2644/hawke-s-bay-half-day-4-winery-tasting-and-tour-with-pickup-t1322749/
554970,Wellington,https://www.getyourguide.com/en-gb/wellington-l943/wellington-3-hour-walking-food-tour-t554970/
433278,Picton: Picton Shore Excursion: Queen Charlotte Sounds Cruise,https://www.getyourguide.com/en-gb/picton-l32311/picton-shore-excursion-queen-charlotte-sounds-cruise-t433278/
264347,Lake Tekapo: Indoor Dark Sky Cultural Astronomy Experience,https://www.getyourguide.com/en-gb/lake-tekapo-l113317/tekapo-immersive-stargazing-and-astronomy-experience-t264347/
411173,Wanaka: Waterfall Climb and Canyon Tour,https://www.getyourguide.com/en-gb/wanaka-l946/wanaka-canyoning-tour-with-helicopter-transfers-t411173/
533537,Fiordland National Park: Premium Small Group Cruise with Canape Lunch,https://www.getyourguide.com/en-gb/fiordland-national-park-l936/milford-sound-premium-milford-sound-cruise-t533537/
951994,"Auckland: Rotorua Highlights Tour, Waiotapu, Te Puia & Lunch",https://www.getyourguide.com/en-gb/rotorua-l1398/auckland-rotorua-highlights-inc-wai-o-tapu-te-puia-tour-t951994/
461569,Christchurch: Christchurch to Mt Cook via Lake Tekapo (1 way),https://www.getyourguide.com/en-gb/aoraki-mount-cook-village-l126608/christchurch-to-mt-cook-via-lake-tekapo-1-way-t461569/
1076189,Dunedin: Dunedin to Invercargill via the Catlins (one-way tour),https://www.getyourguide.com/en-gb/dunedin-l2026/dunedin-to-invercargill-via-the-catlins-one-way-tour-t1076189/
505292,Hanmer Springs: Guided Stargazing Tour,https://www.getyourguide.com/en-gb/hanmer-springs-l91743/guided-stargazing-tours-in-hanmer-springs-t505292/
851816,Okere Falls: Evening Starlight Gourmet Kayak Tour with dinner,https://www.getyourguide.com/en-gb/rotorua-l1398/rotorua-evening-starlight-gourmet-kayak-tour-with-dinner-t851816/
1297620,Auckland: Aotearoa Bone and Stone - Maori Pounamu Workshop,https://www.getyourguide.com/en-gb/auckland-l822/auckland-maori-pounamugreenstone-workshop-t1297620/
361075,Queenstown: Hidden Underwater Theatre Experience,https://www.getyourguide.com/en-gb/queenstown-l498/queenstown-underwater-theatre-experience-entry-ticket-t361075/
468823,Auckland: Private Customizable Walking Tour with Local Guide,https://www.getyourguide.com/en-gb/auckland-l822/auckland-private-custom-tour-with-a-local-guide-t468823/
823461,Napier: Cruise Self-Guided Cycle Ride to Winery - Half Day,https://www.getyourguide.com/en-gb/napier-l2644/napier-cruise-self-guided-cycle-ride-to-winery-half-day-t823461/
879577,Auckland: City Sights & Sheep Shearing with Lunch,https://www.getyourguide.com/en-gb/auckland-l822/auckland-city-sights-sheep-shearing-with-lunch-t879577/
1186579,Rotorua: Lake Rotorua Cruise with Buffet Dining Option,https://www.getyourguide.com/en-gb/rotorua-l1398/rotorua-lake-rotorua-cruise-with-buffet-dining-option-t1186579/
462294,Abel Tasman National Park: Self-Guided Walk & Sailing,https://www.getyourguide.com/en-gb/marahau-l142416/abel-tasman-national-park-self-guided-walk-sailing-t462294/
780780,Auckland: Auckland Nature Tour,https://www.getyourguide.com/en-gb/auckland-l822/auckland-nature-tour-t780780/
1035352,"Auckland: Birdwatching, Hiking & Waterfalls Tour",https://www.getyourguide.com/en-gb/auckland-l822/auckland-birdwatching-hiking-waterfalls-tour-t1035352/
754202,Auckland: Rotorua & Taupo DayTour Waiotapu & Huka Falls from Auckland,https://www.getyourguide.com/en-gb/auckland-l822/rotorua-taupo-daytour-waiotapu-huka-falls-from-auckland-t754202/
1148301,Auckland: Auckland：Kumeu Wine Tasting & Local Flavours Tour,https://www.getyourguide.com/en-gb/auckland-l822/auckland-kumeu-wine-tasting-tour-and-black-sand-beach-t1148301/
